52,"Lead Representative NS, Fund/Client Accounting","
Locations:
Wilmington, Delaware
","Fund/Client Accounting - S5 (Non-Supervisory)

Serves as a lead for the day-to-day operations of a medium-sized fund accounting support team, providing work direction and technical assistance on complex matters.

Leads day-to-day accounting and net asset value (NAV) production functions (including NAV construction & validation, NAV review, dissemination and reporting activities) for more complex funds.  Reviews data and assists in resolving escalated problems that may arise during the normal daily, weekly or monthly accounting and reporting.

Tracks data and maintains accounting records for funds of higher complexity in accordance with department policies and procedures.  Establishes data maintenance and summarization processes to improve team efficiency and best support the accounting team.

Leads team in preparing system-generated reports.  Coordinates review of reports and the sharing of reports with accounting teams.  Reviews work of junior team members.

Assists with maintaining relationships with client staff. Regularly works with client staff to exchange information with respect to cash, accounting, and reporting of daily and monthly client activities and initiatives.  Communicates data needs and answers client questions.

Assists in identifying and implementing process improvements to reduce audit and financial exposure and improve team efficiency.

No direct reports;; may have work allocation and team lead responsibilities .

Supports the achievement of team objectives.  Qualifications Bachelor's degree in accounting or the equivalent combination of education and experience is required. 5-7 years of total work experience preferred;; experience in accounting support preferred. BNY Mellon is an Equal Employment Opportunity/Affirmative Action Employer.Minorities/Females/Individuals With Disabilities/Protected Veterans.  Primary Location: United States-Delaware-Wilmington Internal Jobcode: 70710 Job: Finance/Accounting Organization: AIS Operations-HR08997 Requisition Number: 1819332"
53,"Lead Representative NS, Fund/Client Accounting","
Multiple Locations:
New York, New York; Woodland Park, New Jersey
","Fund/Client Accounting - S5 (Non-Supervisory)

Serves as a lead for the day-to-day operations of a medium-sized fund accounting support team, providing work direction and technical assistance on complex matters.

Leads day-to-day accounting and net asset value (NAV) production functions (including NAV construction & validation, NAV review, dissemination and reporting activities) for more complex funds.  Reviews data and assists in resolving escalated problems that may arise during the normal daily, weekly or monthly accounting and reporting.

Tracks data and maintains accounting records for funds of higher complexity in accordance with department policies and procedures.  Establishes data maintenance and summarization processes to improve team efficiency and best support the accounting team.

Leads team in preparing system-generated reports.  Coordinates review of reports and the sharing of reports with accounting teams.  Reviews work of junior team members.

Assists with maintaining relationships with client staff. Regularly works with client staff to exchange information with respect to cash, accounting, and reporting of daily and monthly client activities and initiatives.  Communicates data needs and answers client questions.

Assists in identifying and implementing process improvements to reduce audit and financial exposure and improve team efficiency.

No direct reports;; may have work allocation and team lead responsibilities .

Supports the achievement of team objectives. Qualifications  Bachelor's degree in accounting or the equivalent combination of education and experience is required. 5-7 years of total work experience preferred;; experience in accounting support preferred. BNY Mellon is an Equal Employment Opportunity/Affirmative Action Employer.Minorities/Females/Individuals With Disabilities/Protected Veterans.  Primary Location: United States-New York-New York Internal Jobcode: 70710 Job: Finance/Accounting Organization: AIS Operations-HR08997 Requisition Number: 1900533"
54,"Lead Representative NS, Fund/Client Accounting","
Locations:
Lake Mary, Florida
","Fund/Client Accounting - S5 (Non-Supervisory)

Serves as a lead for the day-to-day operations of a medium-sized fund accounting support team, providing work direction and technical assistance on complex matters.

Leads day-to-day accounting and net asset value (NAV) production functions (including NAV construction & validation, NAV review, dissemination and reporting activities) for more complex funds.  Reviews data and assists in resolving escalated problems that may arise during the normal daily, weekly or monthly accounting and reporting.

Tracks data and maintains accounting records for funds of higher complexity in accordance with department policies and procedures.  Establishes data maintenance and summarization processes to improve team efficiency and best support the accounting team.

Leads team in preparing system-generated reports.  Coordinates review of reports and the sharing of reports with accounting teams.  Reviews work of junior team members.

Assists with maintaining relationships with client staff. Regularly works with client staff to exchange information with respect to cash, accounting, and reporting of daily and monthly client activities and initiatives.  Communicates data needs and answers client questions.

Assists in identifying and implementing process improvements to reduce audit and financial exposure and improve team efficiency.

No direct reports;; may have work allocation and team lead responsibilities .

Supports the achievement of team objectives.   Qualifications Bachelor's degree in accounting or the equivalent combination of education and experience is required. 5-7 years of total work experience preferred;; experience in accounting support preferred. Fund Accounting experience with a focus in Private Equity Funds preferred. Experience working on complex fund structures and some knowledge of performance and management fee calculations, and waterfalls preferred.  BNY Mellon is an Equal Employment Opportunity/Affirmative Action Employer.Minorities/Females/Individuals With Disabilities/Protected Veterans.  Primary Location: United States-Florida-Lake Mary Internal Jobcode: 70710 Job: Finance/Accounting Organization: AIS Operations-HR08997 Requisition Number: 1900526"
55,"Lead Representative NS, Fund/Client Accounting","
Locations:
Lake Mary, Florida
","Fund/Client Accounting - S5 (Non-Supervisory)

Serves as a lead for the day-to-day operations of a medium-sized fund accounting support team, providing work direction and technical assistance on complex matters.

Leads day-to-day accounting and net asset value (NAV) production functions (including NAV construction & validation, NAV review, dissemination and reporting activities) for more complex funds.  Reviews data and assists in resolving escalated problems that may arise during the normal daily, weekly or monthly accounting and reporting.

Tracks data and maintains accounting records for funds of higher complexity in accordance with department policies and procedures.  Establishes data maintenance and summarization processes to improve team efficiency and best support the accounting team.

Leads team in preparing system-generated reports.  Coordinates review of reports and the sharing of reports with accounting teams.  Reviews work of junior team members.

Assists with maintaining relationships with client staff. Regularly works with client staff to exchange information with respect to cash, accounting, and reporting of daily and monthly client activities and initiatives.  Communicates data needs and answers client questions.

Assists in identifying and implementing process improvements to reduce audit and financial exposure and improve team efficiency.

No direct reports;; may have work allocation and team lead responsibilities .

Supports the achievement of team objectives.   Qualifications Bachelor's degree in accounting or the equivalent combination of education and experience is required. 5-7 years of total work experience preferred;; experience in accounting support preferred. Fund Accounting experience with a focus in Private Equity Funds preferred. Experience working on complex fund structures and some knowledge of performance and management fee calculations, and waterfalls preferred.  BNY Mellon is an Equal Employment Opportunity/Affirmative Action Employer.Minorities/Females/Individuals With Disabilities/Protected Veterans.  Primary Location: United States-Florida-Lake Mary Internal Jobcode: 70710 Job: Finance/Accounting Organization: AIS Operations-HR08997 Requisition Number: 1900527"
56,"Lead Representative NS, Fund/Client Accounting","
Locations:
Lake Mary, Florida
","Fund/Client Accounting - S5 (Non-Supervisory)

Serves as a lead for the day-to-day operations of a medium-sized fund accounting support team, providing work direction and technical assistance on complex matters.

Leads day-to-day accounting and net asset value (NAV) production functions (including NAV construction & validation, NAV review, dissemination and reporting activities) for more complex funds.  Reviews data and assists in resolving escalated problems that may arise during the normal daily, weekly or monthly accounting and reporting.

Tracks data and maintains accounting records for funds of higher complexity in accordance with department policies and procedures.  Establishes data maintenance and summarization processes to improve team efficiency and best support the accounting team.

Leads team in preparing system-generated reports.  Coordinates review of reports and the sharing of reports with accounting teams.  Reviews work of junior team members.

Assists with maintaining relationships with client staff. Regularly works with client staff to exchange information with respect to cash, accounting, and reporting of daily and monthly client activities and initiatives.  Communicates data needs and answers client questions.

Assists in identifying and implementing process improvements to reduce audit and financial exposure and improve team efficiency.

No direct reports;; may have work allocation and team lead responsibilities .

Supports the achievement of team objectives.   Qualifications Bachelor's degree in accounting or the equivalent combination of education and experience is required. 5-7 years of total work experience preferred;; experience in accounting support preferred. Fund Accounting experience with a focus in Private Equity Funds preferred. Experience working on complex fund structures and some knowledge of performance and management fee calculations, and waterfalls preferred.  BNY Mellon is an Equal Employment Opportunity/Affirmative Action Employer.Minorities/Females/Individuals With Disabilities/Protected Veterans.  Primary Location: United States-Florida-Lake Mary Internal Jobcode: 70710 Job: Finance/Accounting Organization: AIS Operations-HR08997 Requisition Number: 1900530"
57,"Specialist, Fund/Client Accounting","
Locations:
Woodland Park, New Jersey
","Fund/Client Accounting - IC4

Conducts accounting services on behalf of assigned clients and complex funds including determining net asset values, calculating fund performance, allocating expenses and preparing reports. May lead work of junior team members for assigned client or fund.

Performs highly complex Fund/Client Accounting responsibilities in the areas of driving Service Improvement plans, targeting efficiencies, enhancing processes and specialist review functions. Provides input into methodologies and checks complex work done by more junior team members.

Provides guidance and reviews work related to cash and asset reconciliations relating to complex accounts or transactions. Resolves reconciliation of accounts for the most complex or atypical transactions and reviews work of junior team members.

Drafts reports for clients regarding the performance of highly complex funds.  Provides guidance on report structure.

Regularly interacts with clients in answering questions and resolving multifaceted issues regarding fund reports and accounting processes.

Evaluates GAAP and/or IFRS rules to determine impact of new regulations on BNY Mellon fund accounting practices.

No direct reports. Provides guidance to less experienced team members.  May be tasked with Team Lead responsibilities. May have people management responsibilities in some geographies.

Contributes to the achievement of related teams objectives.  Qualifications Bachelors degree in accounting or the equivalent combination of education and experience is required. 7-10 years of total work experience preferred. Big 4 accounting firm experience preferred. BNY Mellon is an Equal Employment Opportunity/Affirmative Action Employer.Minorities/Females/Individuals With Disabilities/Protected Veterans.  Primary Location: United States-New Jersey-Woodland Park Internal Jobcode: 70507 Job: Finance/Accounting Organization: AIS Operations-HR08997 Requisition Number: 1900829"
58,"Lead Analyst, Client Processing (Fixed Term Contract - 15 months)","
Locations:
Liverpool, United Kingdom
","Client Billing is a function within the Finance department at Pershing EMEA.  The main objective of the role is to bill clients accurately and on time.  You will have constant interaction with colleagues across EMEA, US and India.  Communication skills and an eagerness for personal development are essential.  Technical skills such as Microsoft Excel and knowledge of either Pershing’s internal systems or another billing system is preferred.  
 
 
Duties:


 Provides complex analytics and reporting services, working to improve and automate Client Processing systems.  

 Manages moderate to complex external client issues.  

 Directly advises other organizational units/teams to ensure timely delivery of service, or resolution of issue.  

 Meets with organizational units/teams to ensure problems and issues are being addressed appropriately and that they are resolved in a timely manner.  

 Participates in product development, product enhancement, and system testing to ensure that products continue to accurately and efficiently process high value transactions.  

 Solves complex problems based on an understanding and knowledge of the intricacies of the system.  

 Integrates in-depth area knowledge with a solid understanding of industry standards and practices to provide solutions to internal and external clients.  

 Provides support to lower level client processing roles.  

 May be responsible for allocating and checking work of other team members.  

 May be responsible for specific supervisory review, training and approval actions.  

 Contributes to the achievement of related teams objectives  
  Qualifications Requirements:


 Bachelors degree or the equivalent combination of education and experience is required.  

 5-7 years of total work experience is preferred.  

 Experience in brokerage processing is preferred.  

 Applicable local/regional licenses or certifications as required by the business. 

Fixed term contract till end of May 2020  BNY Mellon is an Equal Employment Opportunity Employer.  Primary Location: United Kingdom-Merseyside-Liverpool Job: Finance/Accounting Internal Jobcode: 70604 Organization: Pershing International-HR16947 Requisition Number: 1900503"
59,"Prin, Treasury Gen/Multif","
Locations:
Hong Kong, China
","
The Hong Kong Treasury Execution Manager will be a key member of the International Treasury team and will be responsible for managing the liquidity positions across various balance sheets within the APAC region (Hong Kong, Singapore, Sydney, Tokyo).  The Hong Kong Treasury Execution Manager will be responsible for the deployment of excess liquidity in suitable/approved money market instruments with the goal of maximizing net interest income and reducing balance sheet costs whilst staying in compliance to all regulatory limits and balance sheet constraints.  
 
Specific responsibilities of the Hong Kong Treasury Execution Manager include:



Management of surplus liquidity in the balance sheets of Hong Kong, Singapore, Sydney, and Tokyo, by deploying liquidity in suitable short term money market instruments including inter bank placements, FX swaps, bank CDs, central bank placements, inter company placements
Monitoring and execution of trades within the securities portfolio, where required
Funding and liquidity management in compliance to all internal and external regulatory limits including liquidity limits, Volcker limits, market limits, and credit limits, as required
Facing off to the local regulators on liquidity related matters pertaining to the in scope entities, where required.
Testing of sources of liquidity identified in legal entity contingency funding plans and maintaining diverse liquidity sources and access to local markets
Managing market and liquidity risk arising in the banking book
Ensuring strong systems, controls and processes in place, e.g. adhering to trader mandates and desk procedures
Responsible for overseeing Business Continuity Planning for Treasury Execution activities in Hong Kong and ensuring the ability to perform execution of funding and liquidity management transactions on a daily basis across all in scope entities.
 
 Qualifications

To perform this role the candidate will need prior front-office money market dealing experience including strong working knowledge of the interbank money markets and FX swap market, strong treasury product knowledge, risk management skills and understanding of regulations governing the business, and good understanding of funding and liquidity management strategies.  The candidate will also need to have strong written, communication and decision-making skills.
 
The technical skills, knowledge and qualification required for this role are summarised below:
 

Minimum 5-10 years of Treasury front office trading experience
University educated
Prior experience effectively managing Treasury front office execution
Strong understanding of the money market and FX swap markets
Strong risk management skills and understanding of the regulatory environment 
Strong written and communication skills
Sound judgement and decision making skills 
Team player
 
The position is based in Hong Kong and will have a direct reporting line to the International Treasurer.  
 
#L1-PR1

 BNY Mellon is an Equal Employment Opportunity Employer.  Primary Location: China-Hong Kong-Hong Kong Job: Finance/Accounting Internal Jobcode: 85370 Organization: Corporate Treasury-HR06004 Requisition Number: 1900692"
60,"Head of Vendor Management, Sr. Group Manager - Third Party Governance","
Locations:
New York, New York
","
The Third Party Governance (TPG) Vendor Manager is responsible for a team of Vendor Managers. Responsibilities includes enterprise leadership of strategic relationships amongst various stakeholders internally and externally; monitoring the onboarding and ongoing activities between BNY Mellon stakeholders and third parties. This leader collaborates with key business executives, business leaders, external Third Parties and internal subject matter experts to advance TPG program objectives, while adhering to all documented policies and procedures. As part of the TPG leadership, this executive will contribute to TPG strategy and governance oversight, provide thought leadership and executive level training and support as needed. This role is an Executive Director reporting to the Head of Third Party Governance. 
 
Responsibilities:
 
• Provides guidance and consulting on third party governance, oversight, and risk mitigation approaches throughout the third party lifecycle to lines of business, key stakeholders and Senior Management. 
• Helps maintain accurate risk reporting and dashboards, sharing the results with key stakeholders across the business 
• Leads the development, tracking and communication of ongoing monitoring activities and protocols with third party relationships, bringing transparency to the issues and risks of all engagements
• Develops, monitors and communicates treatment strategies for the vendors and engagements
• Ensures vendor risk exposures are accurately measured and reported, escalating issues to the relevant internal partner or subject matter expert to develop an appropriate remediation plan
• Coordinates with senior business leaders who serve the as Executive Sponsors for key vendors to oversee and manage their third party engagements
• Conducts business reviews for top vendors on a regular basis, enabling Engagement Managers and Engagement Sponsors to better manage vendor performance
• Serves as a strategic advisor for a portfolio of third party vendors, well versed in the details of specific engagements while simultaneously managing the broader list of vendors
• Recruits, directs, motivates and develops a staff of more junior managers, maximizing their individual contribution, their professional growth and their ability to function as a team or lead for their team
 
Nature and Scope:
 
•Reports to Managing Director, Third Party Governance 
•This role has direct reports Qualifications
• Bachelor’s degree or equivalent combination of education and work experience required
• 12-15 years of total work experience, with 5-7 years of management experience, preferred.
• Experience in developing and managing teams 
• Experience in a large banking or financial institution as either an internal team member or as an external consultant is preferred
• Background in third party/vendor management and governance, procurement, or regulatory compliance is preferred
• Experience in Risk management organizations preferred For over 230 years, the people of BNY Mellon have been at the forefront of finance, expanding the financial markets while supporting investors throughout the investment lifecycle. BNY Mellon can act as a single point of contact for clients looking to create, trade, hold, manage, service, distribute or restructure investments & safeguards nearly one-fifth of the world's financial assets. BNY Mellon remains one of the safest, most trusted and admired companies. Every day our employees make their mark by helping clients better manage and service their financial assets around the world. Whether providing financial services for institutions, corporations or individual investors, clients count on the people of BNY Mellon across time zones and in 35 countries and more than 100 markets. It's the collective ambition, innovative thinking and exceptionally focused client service paired with a commitment to doing what is right that continues to set us apart. Make your mark: bnymellon.com/careers.Finance helps our internal clients outperform over time. At BNY Mellon, Finance serves our internal clients by providing world-class accounting operations and control and decision support while instituting world-class change management.

Global Procurement is responsible for establishing the programs to acquire products and services for BNY Mellon by employing deep category knowledge and commodity expertise, coupled with an understanding of the needs of our businesses and business partner groups.

The Corporate Treasury group is responsible for managing the investment portfolios and the liquidity and capital positions of the various subsidiary banks and of  BNY Mellon.BNY Mellon is an Equal Employment Opportunity/Affirmative Action Employer.Minorities/Females/Individuals With Disabilities/Protected Veterans.  Primary Location: United States-New York-New York Internal Jobcode: 85241 Job: Finance/Accounting Organization: BNY Mellon CAO-HR16507 Requisition Number: 1900236"
